{
  "schema_version": 1,
  "contract": "observation-index-v1",
  "producer": {"name": "dm-review", "version": "1.77.0", "execution_profile": "partial-review", "source_digest": "sha256:aaaaaaaaaaaaaaaaaaaaaaaaaaaaaaaaaaaaaaaaaaaaaaaaaaaaaaaaaaaaaaaa"},
  "run": {"run_id": "review-partial-86", "session_id": {"availability": "available", "value": "review-session-partial", "provenance": {"source_digest": "sha256:aaaaaaaaaaaaaaaaaaaaaaaaaaaaaaaaaaaaaaaaaaaaaaaaaaaaaaaaaaaaaaaa", "observed_at": "2026-09-01T00:00:00Z"}}, "attempt_ids": {"availability": "unavailable", "value": null, "reason": "source_missing"}, "workflow_node_ids": {"availability": "unavailable", "value": null, "reason": "source_missing"}, "action_ids": {"availability": "unavailable", "value": null, "reason": "source_missing"}},
  "sources": [{"role": "producer", "reference": "receipts/review-partial.json", "digest": "sha256:aaaaaaaaaaaaaaaaaaaaaaaaaaaaaaaaaaaaaaaaaaaaaaaaaaaaaaaaaaaaaaaa", "media_type": "application/json", "size_bytes": 72, "source_timestamp": "2026-09-01T00:00:00Z", "observed_at": "2026-09-01T00:00:00Z", "maximum_age_seconds": 3600, "freshness": "fresh", "freshness_reason": null}],
  "observations": {
    "plugins": {"availability": "unavailable", "value": null, "reason": "not_reported"}, "objective": {"availability": "available", "value": "Review the available exact-head evidence.", "provenance": {"source_digest": "sha256:aaaaaaaaaaaaaaaaaaaaaaaaaaaaaaaaaaaaaaaaaaaaaaaaaaaaaaaaaaaaaaaa", "observed_at": "2026-09-01T00:00:00Z"}}, "budget": {"availability": "unavailable", "value": null, "reason": "not_reported"}, "completion_contract": {"availability": "unavailable", "value": null, "reason": "source_missing"}, "models": {"availability": "unavailable", "value": null, "reason": "not_reported"},
    "usage": {"input_tokens": {"availability": "unavailable", "value": null, "reason": "not_reported"}, "output_tokens": {"availability": "unavailable", "value": null, "reason": "not_reported"}, "cache_read_tokens": {"availability": "unavailable", "value": null, "reason": "not_reported"}, "cache_write_tokens": {"availability": "unavailable", "value": null, "reason": "not_reported"}, "reasoning_tokens": {"availability": "unavailable", "value": null, "reason": "not_reported"}, "duration_seconds": {"availability": "unavailable", "value": null, "reason": "not_reported"}, "model_call_count": {"availability": "unavailable", "value": null, "reason": "not_reported"}, "tool_call_count": {"availability": "unavailable", "value": null, "reason": "not_reported"}},
    "cost": {"status": "unavailable", "value_usd": null, "reason": "not_reported"}, "verifier": {"availability": "unavailable", "value": null, "reason": "source_missing"}, "artifacts": {"availability": "unavailable", "value": null, "reason": "source_missing"}, "recovery": {"availability": "unavailable", "value": null, "reason": "not_applicable"}, "supervision": {"availability": "unavailable", "value": null, "reason": "not_reported"}, "candidates": {"availability": "unavailable", "value": null, "reason": "source_missing"}, "next_action": {"availability": "available", "value": "Record unavailable review lanes.", "provenance": {"source_digest": "sha256:aaaaaaaaaaaaaaaaaaaaaaaaaaaaaaaaaaaaaaaaaaaaaaaaaaaaaaaaaaaaaaaa", "observed_at": "2026-09-01T00:00:00Z"}}
  },
  "emitted_at": "2026-09-01T00:00:00Z",
  "digest": "sha256:f123922845e019dbaf8af5f796c71baf7356546a977740e9342adb35252057c5"
}
