{
  "schema_version": 1,
  "contract": "observation-index-v1",
  "producer": {"name": "pipeline", "version": "1.64.0", "execution_profile": "builder-deep", "source_digest": "sha256:aaaaaaaaaaaaaaaaaaaaaaaaaaaaaaaaaaaaaaaaaaaaaaaaaaaaaaaaaaaaaaaa"},
  "run": {
    "run_id": "pipeline-run-86",
    "session_id": {"availability": "available", "value": "session-1", "provenance": {"source_digest": "sha256:bbbbbbbbbbbbbbbbbbbbbbbbbbbbbbbbbbbbbbbbbbbbbbbbbbbbbbbbbbbbbbbb", "observed_at": "2026-09-01T00:00:00Z"}},
    "attempt_ids": {"availability": "available", "value": ["attempt-1"], "provenance": {"source_digest": "sha256:bbbbbbbbbbbbbbbbbbbbbbbbbbbbbbbbbbbbbbbbbbbbbbbbbbbbbbbbbbbbbbbb", "observed_at": "2026-09-01T00:00:00Z"}},
    "workflow_node_ids": {"availability": "available", "value": ["chunk-01"], "provenance": {"source_digest": "sha256:bbbbbbbbbbbbbbbbbbbbbbbbbbbbbbbbbbbbbbbbbbbbbbbbbbbbbbbbbbbbbbbb", "observed_at": "2026-09-01T00:00:00Z"}},
    "action_ids": {"availability": "available", "value": ["action-1"], "provenance": {"source_digest": "sha256:bbbbbbbbbbbbbbbbbbbbbbbbbbbbbbbbbbbbbbbbbbbbbbbbbbbbbbbbbbbbbbbb", "observed_at": "2026-09-01T00:00:00Z"}}
  },
  "sources": [
    {"role": "producer", "reference": "receipts/pipeline-terminal.json", "digest": "sha256:aaaaaaaaaaaaaaaaaaaaaaaaaaaaaaaaaaaaaaaaaaaaaaaaaaaaaaaaaaaaaaaa", "media_type": "application/json", "size_bytes": 120, "source_timestamp": "2026-09-01T00:00:00Z", "observed_at": "2026-09-01T00:00:00Z", "maximum_age_seconds": 3600, "freshness": "fresh", "freshness_reason": null},
    {"role": "receipts", "reference": "receipts/pipeline-attempts.jsonl", "digest": "sha256:bbbbbbbbbbbbbbbbbbbbbbbbbbbbbbbbbbbbbbbbbbbbbbbbbbbbbbbbbbbbbbbb", "media_type": "application/x-ndjson", "size_bytes": 240, "source_timestamp": "2026-09-01T00:00:00Z", "observed_at": "2026-09-01T00:00:00Z", "maximum_age_seconds": 3600, "freshness": "fresh", "freshness_reason": null},
    {"role": "cost", "reference": "receipts/run-cost-summary.json", "digest": "sha256:cccccccccccccccccccccccccccccccccccccccccccccccccccccccccccccccc", "media_type": "application/json", "size_bytes": 90, "source_timestamp": "2026-08-31T00:00:00Z", "observed_at": "2026-09-01T00:00:00Z", "maximum_age_seconds": 3600, "freshness": "stale", "freshness_reason": "age_exceeded"}
  ],
  "observations": {
    "plugins": {"availability": "available", "value": [{"name": "pipeline", "version": "1.64.0", "digest": "sha256:aaaaaaaaaaaaaaaaaaaaaaaaaaaaaaaaaaaaaaaaaaaaaaaaaaaaaaaaaaaaaaaa"}, {"name": "workflow-kernel", "version": "0.19.0", "digest": "sha256:bbbbbbbbbbbbbbbbbbbbbbbbbbbbbbbbbbbbbbbbbbbbbbbbbbbbbbbbbbbbbbbb"}], "provenance": {"source_digest": "sha256:bbbbbbbbbbbbbbbbbbbbbbbbbbbbbbbbbbbbbbbbbbbbbbbbbbbbbbbbbbbbbbbb", "observed_at": "2026-09-01T00:00:00Z"}},
    "objective": {"availability": "available", "value": "Ship the shared observation contract.", "provenance": {"source_digest": "sha256:bbbbbbbbbbbbbbbbbbbbbbbbbbbbbbbbbbbbbbbbbbbbbbbbbbbbbbbbbbbbbbbb", "observed_at": "2026-09-01T00:00:00Z"}},
    "budget": {"availability": "available", "value": "plans/run-budget.json", "provenance": {"source_digest": "sha256:bbbbbbbbbbbbbbbbbbbbbbbbbbbbbbbbbbbbbbbbbbbbbbbbbbbbbbbbbbbbbbbb", "observed_at": "2026-09-01T00:00:00Z"}},
    "completion_contract": {"availability": "available", "value": "receipts/completion-contract.json", "provenance": {"source_digest": "sha256:bbbbbbbbbbbbbbbbbbbbbbbbbbbbbbbbbbbbbbbbbbbbbbbbbbbbbbbbbbbbbbbb", "observed_at": "2026-09-01T00:00:00Z"}},
    "models": {"availability": "available", "value": [{"requested_model": {"availability": "available", "value": "openai/gpt-requested", "provenance": {"source_digest": "sha256:bbbbbbbbbbbbbbbbbbbbbbbbbbbbbbbbbbbbbbbbbbbbbbbbbbbbbbbbbbbbbbbb", "observed_at": "2026-09-01T00:00:00Z"}}, "attempted_model": {"availability": "available", "value": "openai/gpt-attempted", "provenance": {"source_digest": "sha256:bbbbbbbbbbbbbbbbbbbbbbbbbbbbbbbbbbbbbbbbbbbbbbbbbbbbbbbbbbbbbbbb", "observed_at": "2026-09-01T00:00:00Z"}}, "served_model": {"availability": "available", "value": "openai/gpt-served", "provenance": {"source_digest": "sha256:bbbbbbbbbbbbbbbbbbbbbbbbbbbbbbbbbbbbbbbbbbbbbbbbbbbbbbbbbbbbbbbb", "observed_at": "2026-09-01T00:00:00Z"}}, "provider": {"availability": "available", "value": "openai", "provenance": {"source_digest": "sha256:bbbbbbbbbbbbbbbbbbbbbbbbbbbbbbbbbbbbbbbbbbbbbbbbbbbbbbbbbbbbbbbb", "observed_at": "2026-09-01T00:00:00Z"}}, "routing_rationale": {"availability": "available", "value": "capability_match", "provenance": {"source_digest": "sha256:bbbbbbbbbbbbbbbbbbbbbbbbbbbbbbbbbbbbbbbbbbbbbbbbbbbbbbbbbbbbbbbb", "observed_at": "2026-09-01T00:00:00Z"}}, "fallback_reason": {"availability": "available", "value": "requested_unavailable", "provenance": {"source_digest": "sha256:bbbbbbbbbbbbbbbbbbbbbbbbbbbbbbbbbbbbbbbbbbbbbbbbbbbbbbbbbbbbbbbb", "observed_at": "2026-09-01T00:00:00Z"}}}], "provenance": {"source_digest": "sha256:bbbbbbbbbbbbbbbbbbbbbbbbbbbbbbbbbbbbbbbbbbbbbbbbbbbbbbbbbbbbbbbb", "observed_at": "2026-09-01T00:00:00Z"}},
    "usage": {
      "input_tokens": {"availability": "available", "value": 100, "provenance": {"source_digest": "sha256:bbbbbbbbbbbbbbbbbbbbbbbbbbbbbbbbbbbbbbbbbbbbbbbbbbbbbbbbbbbbbbbb", "observed_at": "2026-09-01T00:00:00Z"}},
      "output_tokens": {"availability": "available", "value": 50, "provenance": {"source_digest": "sha256:bbbbbbbbbbbbbbbbbbbbbbbbbbbbbbbbbbbbbbbbbbbbbbbbbbbbbbbbbbbbbbbb", "observed_at": "2026-09-01T00:00:00Z"}},
      "cache_read_tokens": {"availability": "available", "value": 10, "provenance": {"source_digest": "sha256:bbbbbbbbbbbbbbbbbbbbbbbbbbbbbbbbbbbbbbbbbbbbbbbbbbbbbbbbbbbbbbbb", "observed_at": "2026-09-01T00:00:00Z"}},
      "cache_write_tokens": {"availability": "available", "value": 5, "provenance": {"source_digest": "sha256:bbbbbbbbbbbbbbbbbbbbbbbbbbbbbbbbbbbbbbbbbbbbbbbbbbbbbbbbbbbbbbbb", "observed_at": "2026-09-01T00:00:00Z"}},
      "reasoning_tokens": {"availability": "available", "value": 20, "provenance": {"source_digest": "sha256:bbbbbbbbbbbbbbbbbbbbbbbbbbbbbbbbbbbbbbbbbbbbbbbbbbbbbbbbbbbbbbbb", "observed_at": "2026-09-01T00:00:00Z"}},
      "duration_seconds": {"availability": "available", "value": 12.5, "provenance": {"source_digest": "sha256:bbbbbbbbbbbbbbbbbbbbbbbbbbbbbbbbbbbbbbbbbbbbbbbbbbbbbbbbbbbbbbbb", "observed_at": "2026-09-01T00:00:00Z"}},
      "model_call_count": {"availability": "available", "value": 2, "provenance": {"source_digest": "sha256:bbbbbbbbbbbbbbbbbbbbbbbbbbbbbbbbbbbbbbbbbbbbbbbbbbbbbbbbbbbbbbbb", "observed_at": "2026-09-01T00:00:00Z"}},
      "tool_call_count": {"availability": "available", "value": 3, "provenance": {"source_digest": "sha256:bbbbbbbbbbbbbbbbbbbbbbbbbbbbbbbbbbbbbbbbbbbbbbbbbbbbbbbbbbbbbbbb", "observed_at": "2026-09-01T00:00:00Z"}}
    },
    "cost": {"status": "measured", "value_usd": 0.12, "measurement_reference": "receipts/run-cost-summary.json", "provenance": {"source_digest": "sha256:cccccccccccccccccccccccccccccccccccccccccccccccccccccccccccccccc", "observed_at": "2026-09-01T00:00:00Z"}},
    "verifier": {"availability": "available", "value": {"result": "passed", "evidence_references": ["evidence/tests.json"]}, "provenance": {"source_digest": "sha256:bbbbbbbbbbbbbbbbbbbbbbbbbbbbbbbbbbbbbbbbbbbbbbbbbbbbbbbbbbbbbbbb", "observed_at": "2026-09-01T00:00:00Z"}},
    "artifacts": {"availability": "available", "value": [{"handle": "artifact-1", "reference": "artifacts/output.bin", "digest": "sha256:cccccccccccccccccccccccccccccccccccccccccccccccccccccccccccccccc", "media_type": "application/octet-stream", "size_bytes": 4096, "preview": {"availability": "available", "reference": "artifacts/output.txt", "digest": "sha256:bbbbbbbbbbbbbbbbbbbbbbbbbbbbbbbbbbbbbbbbbbbbbbbbbbbbbbbbbbbbbbbb", "media_type": "text/plain", "size_bytes": 120}}], "provenance": {"source_digest": "sha256:bbbbbbbbbbbbbbbbbbbbbbbbbbbbbbbbbbbbbbbbbbbbbbbbbbbbbbbbbbbbbbbb", "observed_at": "2026-09-01T00:00:00Z"}},
    "recovery": {"availability": "available", "value": {"failure_signature": "sha256:cccccccccccccccccccccccccccccccccccccccccccccccccccccccccccccccc", "recovery_decision": "retry-once"}, "provenance": {"source_digest": "sha256:bbbbbbbbbbbbbbbbbbbbbbbbbbbbbbbbbbbbbbbbbbbbbbbbbbbbbbbbbbbbbbbb", "observed_at": "2026-09-01T00:00:00Z"}},
    "supervision": {"availability": "available", "value": {"stagnation": true, "intervention": "human-review"}, "provenance": {"source_digest": "sha256:bbbbbbbbbbbbbbbbbbbbbbbbbbbbbbbbbbbbbbbbbbbbbbbbbbbbbbbbbbbbbbbb", "observed_at": "2026-09-01T00:00:00Z"}},
    "candidates": {"availability": "available", "value": [{"candidate_id": "candidate-1", "parent_ids": [], "score": {"availability": "unavailable", "value": null, "reason": "consumer_not_defined"}, "disposition": "accepted", "provenance": {"source_digest": "sha256:bbbbbbbbbbbbbbbbbbbbbbbbbbbbbbbbbbbbbbbbbbbbbbbbbbbbbbbbbbbbbbbb", "observed_at": "2026-09-01T00:00:00Z"}}], "provenance": {"source_digest": "sha256:bbbbbbbbbbbbbbbbbbbbbbbbbbbbbbbbbbbbbbbbbbbbbbbbbbbbbbbbbbbbbbbb", "observed_at": "2026-09-01T00:00:00Z"}},
    "next_action": {"availability": "available", "value": "Open the exact-head pull request.", "provenance": {"source_digest": "sha256:bbbbbbbbbbbbbbbbbbbbbbbbbbbbbbbbbbbbbbbbbbbbbbbbbbbbbbbbbbbbbbbb", "observed_at": "2026-09-01T00:00:00Z"}}
  },
  "emitted_at": "2026-09-01T00:00:00Z",
  "digest": "sha256:752360670bb48a6f7ef43634305bc98e9683b380589670e2b0fd5e6aa02e0f86"
}
