{
  "schema_version": 1,
  "contract": "observation-index-v1",
  "producer": {"name": "dm-review", "version": "1.77.0", "execution_profile": "full-review", "source_digest": "sha256:aaaaaaaaaaaaaaaaaaaaaaaaaaaaaaaaaaaaaaaaaaaaaaaaaaaaaaaaaaaaaaaa"},
  "run": {
    "run_id": "review-run-86",
    "session_id": {"availability": "available", "value": "review-session-1", "provenance": {"source_digest": "sha256:bbbbbbbbbbbbbbbbbbbbbbbbbbbbbbbbbbbbbbbbbbbbbbbbbbbbbbbbbbbbbbbb", "observed_at": "2026-09-01T00:00:00Z"}},
    "attempt_ids": {"availability": "available", "value": ["review-attempt-1"], "provenance": {"source_digest": "sha256:bbbbbbbbbbbbbbbbbbbbbbbbbbbbbbbbbbbbbbbbbbbbbbbbbbbbbbbbbbbbbbbb", "observed_at": "2026-09-01T00:00:00Z"}},
    "workflow_node_ids": {"availability": "available", "value": ["security-lane"], "provenance": {"source_digest": "sha256:bbbbbbbbbbbbbbbbbbbbbbbbbbbbbbbbbbbbbbbbbbbbbbbbbbbbbbbbbbbbbbbb", "observed_at": "2026-09-01T00:00:00Z"}},
    "action_ids": {"availability": "available", "value": ["finding-contribution"], "provenance": {"source_digest": "sha256:bbbbbbbbbbbbbbbbbbbbbbbbbbbbbbbbbbbbbbbbbbbbbbbbbbbbbbbbbbbbbbbb", "observed_at": "2026-09-01T00:00:00Z"}}
  },
  "sources": [
    {"role": "producer", "reference": "receipts/review-terminal.json", "digest": "sha256:aaaaaaaaaaaaaaaaaaaaaaaaaaaaaaaaaaaaaaaaaaaaaaaaaaaaaaaaaaaaaaaa", "media_type": "application/json", "size_bytes": 120, "source_timestamp": "2026-09-01T00:00:00Z", "observed_at": "2026-09-01T00:00:00Z", "maximum_age_seconds": 3600, "freshness": "fresh", "freshness_reason": null},
    {"role": "contributions", "reference": "receipts/finding-contributions.json", "digest": "sha256:bbbbbbbbbbbbbbbbbbbbbbbbbbbbbbbbbbbbbbbbbbbbbbbbbbbbbbbbbbbbbbbb", "media_type": "application/json", "size_bytes": 300, "source_timestamp": "2026-09-01T00:00:00Z", "observed_at": "2026-09-01T00:00:00Z", "maximum_age_seconds": 3600, "freshness": "fresh", "freshness_reason": null},
    {"role": "cost", "reference": "receipts/review-cost.json", "digest": "sha256:cccccccccccccccccccccccccccccccccccccccccccccccccccccccccccccccc", "media_type": "application/json", "size_bytes": 90, "source_timestamp": "2026-09-01T00:00:00Z", "observed_at": "2026-09-01T00:00:00Z", "maximum_age_seconds": 3600, "freshness": "fresh", "freshness_reason": null}
  ],
  "observations": {
    "plugins": {"availability": "available", "value": [{"name": "dm-review", "version": "1.77.0", "digest": "sha256:aaaaaaaaaaaaaaaaaaaaaaaaaaaaaaaaaaaaaaaaaaaaaaaaaaaaaaaaaaaaaaaa"}, {"name": "workflow-kernel", "version": "0.19.0", "digest": "sha256:bbbbbbbbbbbbbbbbbbbbbbbbbbbbbbbbbbbbbbbbbbbbbbbbbbbbbbbbbbbbbbbb"}], "provenance": {"source_digest": "sha256:bbbbbbbbbbbbbbbbbbbbbbbbbbbbbbbbbbbbbbbbbbbbbbbbbbbbbbbbbbbbbbbb", "observed_at": "2026-09-01T00:00:00Z"}},
    "objective": {"availability": "available", "value": "Review exact-head changes.", "provenance": {"source_digest": "sha256:bbbbbbbbbbbbbbbbbbbbbbbbbbbbbbbbbbbbbbbbbbbbbbbbbbbbbbbbbbbbbbbb", "observed_at": "2026-09-01T00:00:00Z"}},
    "budget": {"availability": "available", "value": "receipts/review-request.json", "provenance": {"source_digest": "sha256:bbbbbbbbbbbbbbbbbbbbbbbbbbbbbbbbbbbbbbbbbbbbbbbbbbbbbbbbbbbbbbbb", "observed_at": "2026-09-01T00:00:00Z"}},
    "completion_contract": {"availability": "available", "value": "receipts/review-completion.json", "provenance": {"source_digest": "sha256:bbbbbbbbbbbbbbbbbbbbbbbbbbbbbbbbbbbbbbbbbbbbbbbbbbbbbbbbbbbbbbbb", "observed_at": "2026-09-01T00:00:00Z"}},
    "models": {"availability": "available", "value": [{"requested_model": {"availability": "available", "value": "review/model-a", "provenance": {"source_digest": "sha256:bbbbbbbbbbbbbbbbbbbbbbbbbbbbbbbbbbbbbbbbbbbbbbbbbbbbbbbbbbbbbbbb", "observed_at": "2026-09-01T00:00:00Z"}}, "attempted_model": {"availability": "available", "value": "review/model-a", "provenance": {"source_digest": "sha256:bbbbbbbbbbbbbbbbbbbbbbbbbbbbbbbbbbbbbbbbbbbbbbbbbbbbbbbbbbbbbbbb", "observed_at": "2026-09-01T00:00:00Z"}}, "served_model": {"availability": "available", "value": "review/model-a", "provenance": {"source_digest": "sha256:bbbbbbbbbbbbbbbbbbbbbbbbbbbbbbbbbbbbbbbbbbbbbbbbbbbbbbbbbbbbbbbb", "observed_at": "2026-09-01T00:00:00Z"}}, "provider": {"availability": "available", "value": "openai", "provenance": {"source_digest": "sha256:bbbbbbbbbbbbbbbbbbbbbbbbbbbbbbbbbbbbbbbbbbbbbbbbbbbbbbbbbbbbbbbb", "observed_at": "2026-09-01T00:00:00Z"}}, "routing_rationale": {"availability": "available", "value": "review-strength", "provenance": {"source_digest": "sha256:bbbbbbbbbbbbbbbbbbbbbbbbbbbbbbbbbbbbbbbbbbbbbbbbbbbbbbbbbbbbbbbb", "observed_at": "2026-09-01T00:00:00Z"}}, "fallback_reason": {"availability": "unavailable", "value": null, "reason": "not_applicable"}}], "provenance": {"source_digest": "sha256:bbbbbbbbbbbbbbbbbbbbbbbbbbbbbbbbbbbbbbbbbbbbbbbbbbbbbbbbbbbbbbbb", "observed_at": "2026-09-01T00:00:00Z"}},
    "usage": {"input_tokens": {"availability": "available", "value": 200, "provenance": {"source_digest": "sha256:bbbbbbbbbbbbbbbbbbbbbbbbbbbbbbbbbbbbbbbbbbbbbbbbbbbbbbbbbbbbbbbb", "observed_at": "2026-09-01T00:00:00Z"}}, "output_tokens": {"availability": "available", "value": 75, "provenance": {"source_digest": "sha256:bbbbbbbbbbbbbbbbbbbbbbbbbbbbbbbbbbbbbbbbbbbbbbbbbbbbbbbbbbbbbbbb", "observed_at": "2026-09-01T00:00:00Z"}}, "cache_read_tokens": {"availability": "available", "value": 30, "provenance": {"source_digest": "sha256:bbbbbbbbbbbbbbbbbbbbbbbbbbbbbbbbbbbbbbbbbbbbbbbbbbbbbbbbbbbbbbbb", "observed_at": "2026-09-01T00:00:00Z"}}, "cache_write_tokens": {"availability": "available", "value": 4, "provenance": {"source_digest": "sha256:bbbbbbbbbbbbbbbbbbbbbbbbbbbbbbbbbbbbbbbbbbbbbbbbbbbbbbbbbbbbbbbb", "observed_at": "2026-09-01T00:00:00Z"}}, "reasoning_tokens": {"availability": "available", "value": 25, "provenance": {"source_digest": "sha256:bbbbbbbbbbbbbbbbbbbbbbbbbbbbbbbbbbbbbbbbbbbbbbbbbbbbbbbbbbbbbbbb", "observed_at": "2026-09-01T00:00:00Z"}}, "duration_seconds": {"availability": "available", "value": 18.0, "provenance": {"source_digest": "sha256:bbbbbbbbbbbbbbbbbbbbbbbbbbbbbbbbbbbbbbbbbbbbbbbbbbbbbbbbbbbbbbbb", "observed_at": "2026-09-01T00:00:00Z"}}, "model_call_count": {"availability": "available", "value": 1, "provenance": {"source_digest": "sha256:bbbbbbbbbbbbbbbbbbbbbbbbbbbbbbbbbbbbbbbbbbbbbbbbbbbbbbbbbbbbbbbb", "observed_at": "2026-09-01T00:00:00Z"}}, "tool_call_count": {"availability": "available", "value": 2, "provenance": {"source_digest": "sha256:bbbbbbbbbbbbbbbbbbbbbbbbbbbbbbbbbbbbbbbbbbbbbbbbbbbbbbbbbbbbbbbb", "observed_at": "2026-09-01T00:00:00Z"}}},
    "cost": {"status": "imputed", "value_usd": 0.08, "matrix_snapshot": "2026-09-01", "matrix_digest": "sha256:cccccccccccccccccccccccccccccccccccccccccccccccccccccccccccccccc", "basis": "api-equivalent", "provenance": {"source_digest": "sha256:cccccccccccccccccccccccccccccccccccccccccccccccccccccccccccccccc", "observed_at": "2026-09-01T00:00:00Z"}},
    "verifier": {"availability": "available", "value": {"result": "passed", "evidence_references": ["receipts/review-verification.json"]}, "provenance": {"source_digest": "sha256:bbbbbbbbbbbbbbbbbbbbbbbbbbbbbbbbbbbbbbbbbbbbbbbbbbbbbbbbbbbbbbbb", "observed_at": "2026-09-01T00:00:00Z"}},
    "artifacts": {"availability": "available", "value": [{"handle": "finding-inventory", "reference": "review/raw-findings.json", "digest": "sha256:cccccccccccccccccccccccccccccccccccccccccccccccccccccccccccccccc", "media_type": "application/json", "size_bytes": 800, "preview": {"availability": "unavailable", "reference": null, "reason": "not_applicable"}}], "provenance": {"source_digest": "sha256:bbbbbbbbbbbbbbbbbbbbbbbbbbbbbbbbbbbbbbbbbbbbbbbbbbbbbbbbbbbbbbbb", "observed_at": "2026-09-01T00:00:00Z"}},
    "recovery": {"availability": "unavailable", "value": null, "reason": "not_applicable"},
    "supervision": {"availability": "available", "value": {"stagnation": false, "intervention": "none-recorded"}, "provenance": {"source_digest": "sha256:bbbbbbbbbbbbbbbbbbbbbbbbbbbbbbbbbbbbbbbbbbbbbbbbbbbbbbbbbbbbbbbb", "observed_at": "2026-09-01T00:00:00Z"}},
    "candidates": {"availability": "available", "value": [{"candidate_id": "finding-v1", "parent_ids": ["source-finding-1"], "score": {"availability": "unavailable", "value": null, "reason": "consumer_not_defined"}, "disposition": "rejected", "provenance": {"source_digest": "sha256:bbbbbbbbbbbbbbbbbbbbbbbbbbbbbbbbbbbbbbbbbbbbbbbbbbbbbbbbbbbbbbbb", "observed_at": "2026-09-01T00:00:00Z"}}], "provenance": {"source_digest": "sha256:bbbbbbbbbbbbbbbbbbbbbbbbbbbbbbbbbbbbbbbbbbbbbbbbbbbbbbbbbbbbbbbb", "observed_at": "2026-09-01T00:00:00Z"}},
    "next_action": {"availability": "available", "value": "Return review findings to the producer.", "provenance": {"source_digest": "sha256:bbbbbbbbbbbbbbbbbbbbbbbbbbbbbbbbbbbbbbbbbbbbbbbbbbbbbbbbbbbbbbbb", "observed_at": "2026-09-01T00:00:00Z"}}
  },
  "emitted_at": "2026-09-01T00:00:00Z",
  "digest": "sha256:10aedff68fcdf2841a77b387ca0144268d97059015a76336cff4313d56683922"
}
