{
  "schema_version": 1,
  "contract": "observation-index-v1",
  "producer": {"name": "generic-harness", "version": "1.0.0", "execution_profile": "generic", "source_digest": "sha256:aaaaaaaaaaaaaaaaaaaaaaaaaaaaaaaaaaaaaaaaaaaaaaaaaaaaaaaaaaaaaaaa"},
  "run": {"run_id": "generic-run-86", "session_id": {"availability": "unavailable", "value": null, "reason": "unsupported_by_harness"}, "attempt_ids": {"availability": "unavailable", "value": null, "reason": "unsupported_by_harness"}, "workflow_node_ids": {"availability": "unavailable", "value": null, "reason": "unsupported_by_harness"}, "action_ids": {"availability": "unavailable", "value": null, "reason": "unsupported_by_harness"}},
  "sources": [{"role": "producer", "reference": "receipts/generic-terminal.json", "digest": "sha256:aaaaaaaaaaaaaaaaaaaaaaaaaaaaaaaaaaaaaaaaaaaaaaaaaaaaaaaaaaaaaaaa", "media_type": "application/json", "size_bytes": 40, "source_timestamp": "2026-09-01T00:00:00Z", "observed_at": "2026-09-01T00:00:00Z", "maximum_age_seconds": null, "freshness": "unknown", "freshness_reason": "not_reported"}],
  "observations": {
    "plugins": {"availability": "unavailable", "value": null, "reason": "unsupported_by_harness"}, "objective": {"availability": "unavailable", "value": null, "reason": "not_reported"}, "budget": {"availability": "unavailable", "value": null, "reason": "not_reported"}, "completion_contract": {"availability": "unavailable", "value": null, "reason": "not_reported"}, "models": {"availability": "unavailable", "value": null, "reason": "not_reported"},
    "usage": {"input_tokens": {"availability": "unavailable", "value": null, "reason": "not_reported"}, "output_tokens": {"availability": "unavailable", "value": null, "reason": "not_reported"}, "cache_read_tokens": {"availability": "unavailable", "value": null, "reason": "not_reported"}, "cache_write_tokens": {"availability": "unavailable", "value": null, "reason": "not_reported"}, "reasoning_tokens": {"availability": "unavailable", "value": null, "reason": "not_reported"}, "duration_seconds": {"availability": "unavailable", "value": null, "reason": "not_reported"}, "model_call_count": {"availability": "unavailable", "value": null, "reason": "not_reported"}, "tool_call_count": {"availability": "unavailable", "value": null, "reason": "not_reported"}},
    "cost": {"status": "unavailable", "value_usd": null, "reason": "not_reported"}, "verifier": {"availability": "unavailable", "value": null, "reason": "not_reported"}, "artifacts": {"availability": "unavailable", "value": null, "reason": "not_reported"}, "recovery": {"availability": "unavailable", "value": null, "reason": "not_applicable"}, "supervision": {"availability": "unavailable", "value": null, "reason": "consumer_not_defined"}, "candidates": {"availability": "unavailable", "value": null, "reason": "consumer_not_defined"}, "next_action": {"availability": "unavailable", "value": null, "reason": "not_reported"}
  },
  "emitted_at": "2026-09-01T00:00:00Z",
  "digest": "sha256:7f1ed581633315e0d1adf039192fae28bcbcdb96d200b3ea0e2f298904b190e5"
}
